Name,Owner,Category,Description,Tags,Quantization,Max Context Tokens,Pricing Type,Pricing,Deprecated,Replaced By
black-forest-labs/FLUX-1-Redux-dev,black-forest-labs,text-to-image,"FLUX.1 Redux [dev] is an image variation generation adapter for all FLUX.1 base models. It enables users to refine images with slight variations and supports text-based restyling via API. Integrated with FLUX1.1 [pro] Ultra, it allows for high-quality 4-megapixel outputs. The model can be used with Diffusers in Python for efficient image generation. While powerful, it has ethical and factual limitations and is governed by a non-commercial license.",,,,image_units,$0.012000/image unit,,
black-forest-labs/FLUX-1-dev,black-forest-labs,text-to-image,"FLUX.1-dev is a state-of-the-art 12 billion parameter rectified flow transformer developed by Black Forest Labs. This model excels in text-to-image generation, providing highly accurate and detailed outputs. It is particularly well-regarded for its ability to follow complex prompts and generate anatomically accurate images, especially with challenging details like hands and faces.",no-free-anon; lora-base,,,image_units,$0.009000/image unit,,
black-forest-labs/FLUX-1-schnell,black-forest-labs,text-to-image,"FLUX.1 [schnell] is a 12 billion parameter rectified flow transformer capable of generating images from text descriptions. This model offers cutting-edge output quality and competitive prompt following, matching the performance of closed source alternatives. Trained using latent adversarial diffusion distillation, FLUX.1 [schnell] can generate high-quality images in only 1 to 4 steps. ",no-free-anon; lora-base,,,image_units,$0.000500/image unit,,
black-forest-labs/FLUX-1.1-pro,black-forest-labs,text-to-image,"Black Forest Labs' latest state-of-the art proprietary model sporting top of the line prompt following, visual quality, details and output diversity.",no-free-anon,,,image_units,$0.040000/image unit,,
black-forest-labs/FLUX-2-dev,black-forest-labs,text-to-image,"Brand-new Flux2 Dev introduces a faster, more modular architecture for next-generation image generation pipelines. It delivers improved performance, cleaner control APIs, and a significantly more flexible development workflow for custom inference setups.",,,,image_units,$0.010000/image unit,,
black-forest-labs/FLUX-2-max,black-forest-labs,text-to-image,"The new top-tier image model from Black Forest Labs, significantly pushing image quality and editing consistency",no-free-anon,,,image_units,$0.100000/image unit,,
black-forest-labs/FLUX-2-pro,black-forest-labs,text-to-image,"Multi-reference visual intelligence with unprecedented detail, color precision, and spatial reasoning.  The most advanced image generation and editing model. Generate photorealistic images with precise control.",no-free-anon,,,image_units,$0.015000/image unit,,
black-forest-labs/FLUX-pro,black-forest-labs,text-to-image,Black Forest Labs' first flagship model based on Flux latent rectified flow transformers,no-free-anon,,,image_units,$0.050000/image unit,,
black-forest-labs/FLUX.1-Kontext-dev,black-forest-labs,text-to-image,"FLUX.1 Kontext [dev] is a 12-billion-parameter image editing model that transforms visuals based on natural language instructions. It allows highly consistent, multi-step edits and is released with open weights under a non-commercial license to empower artists and researchers.",,,,image_units,$0.010000/image unit,,
canopylabs/orpheus-3b-0.1-ft,canopylabs,text-to-speech,"Orpheus TTS is a state-of-the-art, Llama-based Speech-LLM designed for high-quality, empathetic text-to-speech generation. This model has been finetuned to deliver human-level speech synthesis, achieving exceptional clarity, expressiveness, and real-time streaming performances.",,,,input_character_length,$NaN/1M characters,,
cognitivecomputations/dolphin-2.6-mixtral-8x7b,cognitivecomputations,text-generation,"The Dolphin 2.6 Mixtral 8x7b model is a finetuned version of the Mixtral-8x7b model, trained on a variety of data including coding data, for 3 days on 4 A100 GPUs. It is uncensored and requires trust_remote_code. The model is very obedient and good at coding, but not DPO tuned. The dataset has been filtered for alignment and bias. The model is compliant with user requests and can be used for various purposes such as generating code or engaging in general chat.",openai; json,bfloat16,32768,tokens,$0.2400 in/1M tokens; $0.2400 out/1M tokens,Yes,Qwen/Qwen2.5-72B-Instruct
cognitivecomputations/dolphin-2.9.1-llama-3-70b,cognitivecomputations,text-generation,"Dolphin 2.9.1, a fine-tuned Llama-3-70b model. The new model, trained on filtered data, is more compliant but uncensored. It demonstrates improvements in instruction, conversation, coding, and function calling abilities.",openai,bfloat16,8192,tokens,$0.3500 in/1M tokens; $0.4000 out/1M tokens,Yes,Qwen/Qwen2.5-72B-Instruct
deepinfra/airoboros-70b,deepinfra,text-generation,Latest version of the Airoboros model fine-tunned version of llama-2-70b using the Airoboros dataset. This model is currently running jondurbin/airoboros-l2-70b-2.2.1 ,openai; json,fp16,4096,tokens,$0.7000 in/1M tokens; $0.9000 out/1M tokens,Yes,meta-llama/Llama-3.3-70B-Instruct-Turbo
deepseek-ai/DeepSeek-OCR,deepseek-ai,text-generation,"DeepSeek-OCR as an initial investigation into the feasibility of compressing long contexts via optical 2D mapping. DeepSeek-OCR consists of two components: DeepEncoder and DeepSeek3B-MoE-A570M as the decoder. Specifically, DeepEncoder serves as the core engine, designed to maintain low activations under high-resolution input while achieving high compression ratios to ensure an optimal and manageable number of vision tokens. Experiments show that when the number of text tokens is within 10 times that of vision tokens (i.e., a compression ratio < 10x), the model can achieve decoding (OCR) precision of 97%. Even at a compression ratio of 20x, the OCR accuracy still remains at about 60%. This shows considerable promise for research areas such as historical long-context compression and memory forgetting mechanisms in LLMs.",openai; multimodal; cc-native; ocr,bfloat16,8192,tokens,$0.0300 in/1M tokens; $0.1000 out/1M tokens,,
deepseek-ai/DeepSeek-Prover-V2-671B,deepseek-ai,text-generation,"DeepSeek-Prover-V2, an open-source large language model designed for formal theorem proving in Lean 4, with initialization data collected through a recursive theorem proving pipeline powered by DeepSeek-V3. The cold-start training procedure begins by prompting DeepSeek-V3 to decompose complex problems into a series of subgoals. The proofs of resolved subgoals are synthesized into a chain-of-thought process, combined with DeepSeek-V3's step-by-step reasoning, to create an initial cold start for reinforcement learning. ",openai,fp8,163840,tokens,$0.5000 in/1M tokens; $2.1800 out/1M tokens,Yes,deepseek-ai/DeepSeek-V3-0324
deepseek-ai/DeepSeek-R1,deepseek-ai,text-generation,"We introduce DeepSeek-R1, which incorporates cold-start data before RL. DeepSeek-R1 achieves performance comparable to OpenAI-o1 across math, code, and reasoning tasks. ",openai; tools; b200; json,fp4,163840,tokens,$0.7000 in/1M tokens; $2.4000 out/1M tokens,Yes,deepseek-ai/DeepSeek-R1-0528
deepseek-ai/DeepSeek-R1-0528,deepseek-ai,text-generation,"The DeepSeek R1 model has undergone a minor version upgrade, with the current version being DeepSeek-R1-0528.",openai; tools; b200; reasoning; json; structured-output,fp4,163840,tokens,$0.3500 cached/1M tokens; $0.5000 in/1M tokens; $2.1500 out/1M tokens,,
deepseek-ai/DeepSeek-R1-0528-Turbo,deepseek-ai,text-generation,The DeepSeek R1 0528 turbo model is a state of the art reasoning model that can generate very quick responses,openai; tools; b200; reasoning; json,fp4,32768,tokens,$1.0000 in/1M tokens; $3.0000 out/1M tokens,,
deepseek-ai/DeepSeek-R1-Distill-Llama-70B,deepseek-ai,text-generation,"DeepSeek-R1-Distill-Llama-70B is a highly efficient language model that leverages knowledge distillation to achieve state-of-the-art performance. This model distills the reasoning patterns of larger models into a smaller, more agile architecture, resulting in exceptional results on benchmarks like AIME 2024, MATH-500, and LiveCodeBench. With 70 billion parameters, DeepSeek-R1-Distill-Llama-70B offers a unique balance of accuracy and efficiency, making it an ideal choice for a wide range of natural language processing tasks. ",openai; reasoning; json,fp8,131072,tokens,$0.7000 in/1M tokens; $0.8000 out/1M tokens,,
deepseek-ai/DeepSeek-R1-Distill-Qwen-32B,deepseek-ai,text-generation,"DeepSeek R1 Distill Qwen 32B is a distilled large language model based on Qwen 2.5 32B, using outputs from DeepSeek R1. It outperforms OpenAI's o1-mini across various benchmarks, achieving new state-of-the-art results for dense models.  Other benchmark results include:  AIME 2024: 72.6 | MATH-500: 94.3 | CodeForces Rating: 1691.",openai; json,fp8,131072,tokens,$0.2700 in/1M tokens; $0.2700 out/1M tokens,Yes,deepseek-ai/DeepSeek-R1-Distill-Llama-70B
deepseek-ai/DeepSeek-R1-Turbo,deepseek-ai,text-generation,"We introduce DeepSeek-R1, which incorporates cold-start data before RL. DeepSeek-R1 achieves performance comparable to OpenAI-o1 across math, code, and reasoning tasks. ",openai; tools; b200; json,fp4,40960,tokens,$1.0000 in/1M tokens; $3.0000 out/1M tokens,Yes,deepseek-ai/DeepSeek-R1-0528
deepseek-ai/DeepSeek-V3,deepseek-ai,text-generation,"DeepSeek-V3, a strong Mixture-of-Experts (MoE) language model with 671B total parameters with 37B activated for each token. To achieve efficient inference and cost-effective training, DeepSeek-V3 adopts Multi-head Latent Attention (MLA) and DeepSeekMoE architectures, which were thoroughly validated in DeepSeek-V2. ",openai; tools; json; b200; structured-output,fp4,163840,tokens,$0.3200 in/1M tokens; $0.8900 out/1M tokens,,
deepseek-ai/DeepSeek-V3-0324,deepseek-ai,text-generation,"DeepSeek-V3-0324, a strong Mixture-of-Experts (MoE) language model with 671B total parameters with 37B activated for each token, an improved iteration over DeepSeek-V3.",openai; tools; json; b200; structured-output,fp4,163840,tokens,$0.1350 cached/1M tokens; $0.2000 in/1M tokens; $0.7700 out/1M tokens,,
deepseek-ai/DeepSeek-V3-0324-Turbo,deepseek-ai,text-generation,,openai; tools; b200,fp4,32768,tokens,$1.0000 in/1M tokens; $3.0000 out/1M tokens,Yes,deepseek-ai/DeepSeek-V3-0324
deepseek-ai/DeepSeek-V3.1,deepseek-ai,text-generation,"DeepSeek-V3.1 is post-trained on the top of DeepSeek-V3.1-Base, which is built upon the original V3 base checkpoint through a two-phase long context extension approach, following the methodology outlined in the original DeepSeek-V3 report. We have expanded our dataset by collecting additional long documents and substantially extending both training phases. The 32K extension phase has been increased 10-fold to 630B tokens, while the 128K extension phase has been extended by 3.3x to 209B tokens. Additionally, DeepSeek-V3.1 is trained using the UE8M0 FP8 scale data format to ensure compatibility with microscaling data formats.",openai; tools; reasoning; json; can-disable-reasoning; structured-output,fp4,163840,tokens,$0.1300 cached/1M tokens; $0.2100 in/1M tokens; $0.7900 out/1M tokens,,
deepseek-ai/DeepSeek-V3.1-Terminus,deepseek-ai,text-generation,"DeepSeek-V3.1 Terminus is an update to DeepSeek V3.1 that maintains the model's original capabilities while addressing issues reported by users, including language consistency and agent capabilities, further optimizing the model's performance in coding and search agents. It is a large hybrid reasoning model (671B parameters, 37B active) that supports both thinking and non-thinking modes. It extends the DeepSeek-V3 base with a two-phase long-context training process. Users can control the reasoning behaviour with the reasoning enabled boolean. Learn more in our docs  The model improves tool use, code generation, and reasoning efficiency, achieving performance comparable to DeepSeek-R1 on difficult benchmarks while responding more quickly. It supports structured tool calling, code agents, and search agents, making it suitable for research, coding, and agentic workflows.",openai; tools; reasoning; json; can-disable-reasoning; structured-output,fp4,163840,tokens,$0.1300 cached/1M tokens; $0.2100 in/1M tokens; $0.7900 out/1M tokens,,
deepseek-ai/DeepSeek-V3.2-Exp,deepseek-ai,text-generation,DeepSeek-V3.2-Exp is an intermediate step toward the next-generation architecture of the DeepSeek models by introducing DeepSeek Sparse Attention—a sparse attention mechanism designed to explore and validate optimizations for training and inference efficiency in long-context scenarios.,openai; tools; reasoning; can-disable-reasoning; structured-output; json,fp4,163840,tokens,$0.1680 cached/1M tokens; $0.2100 in/1M tokens; $0.3200 out/1M tokens,Yes,deepseek-ai/DeepSeek-V3.2
deepseek-ai/Janus-Pro-1B,deepseek-ai,text-to-image,"Janus-Pro is a novel autoregressive framework that unifies multimodal understanding and generation. It addresses the limitations of previous approaches by decoupling visual encoding into separate pathways, while still utilizing a single, unified transformer architecture for processing. The decoupling not only alleviates the conflict between the visual encoder’s roles in understanding and generation, but also enhances the framework’s flexibility. Janus-Pro surpasses previous unified model and matches or exceeds the performance of task-specific models. The simplicity, high flexibility, and effectiveness of Janus-Pro make it a strong candidate for next-generation unified multimodal models.",,,,image_units,$0.000500/image unit,,
deepseek-ai/Janus-Pro-7B,deepseek-ai,text-to-image,"Janus-Pro is a novel autoregressive framework that unifies multimodal understanding and generation. It addresses the limitations of previous approaches by decoupling visual encoding into separate pathways, while still utilizing a single, unified transformer architecture for processing. The decoupling not only alleviates the conflict between the visual encoder’s roles in understanding and generation, but also enhances the framework’s flexibility. Janus-Pro surpasses previous unified model and matches or exceeds the performance of task-specific models. The simplicity, high flexibility, and effectiveness of Janus-Pro make it a strong candidate for next-generation unified multimodal models.",,,,image_units,$0.002000/image unit,,
google/codegemma-7b-it,google,text-generation,"CodeGemma is a collection of lightweight open code models built on top of Gemma. CodeGemma models are text-to-text and text-to-code decoder-only models and are available as a 7 billion pretrained variant that specializes in code completion and code generation tasks, a 7 billion parameter instruction-tuned variant for code chat and instruction following and a 2 billion parameter pretrained variant for fast code completion.",openai,fp16,8192,tokens,$0.0700 in/1M tokens; $0.0700 out/1M tokens,Yes,google/gemma-3-12b-it
google/embeddinggemma-300m,google,embeddings,"ChatGPT said:  EmbeddingGemma is a 300M parameter multilingual open embedding model from Google DeepMind, designed for efficient deployment even on low-resource devices, producing high-quality text vector representations for tasks such as search, classification, clustering, and semantic similarity.",,,2048,input_tokens,$0.0020/1M tokens,,
google/gemini-1.5-flash,google,text-generation,"Gemini 1.5 Flash is Google's foundation model that performs well at a variety of multimodal tasks such as visual understanding, classification, summarization, and creating content from image, audio and video. It's adept at processing visual and text inputs such as photographs, documents, infographics, and screenshots.  Gemini 1.5 Flash is designed for high-volume, high-frequency tasks where cost and latency matter. ",openai; no-free-anon; multimodal; tools; cc-native; json; structured-output; ocr,,1000000,tokens,$0.0750 in/1M tokens; $0.3000 out/1M tokens,Yes,
google/gemini-1.5-flash-8b,google,text-generation,,openai; no-free-anon; multimodal; tools; cc-native; json; structured-output; ocr,,1000000,tokens,$0.0375 in/1M tokens; $0.1500 out/1M tokens,Yes,
google/gemini-2.0-flash-001,google,text-generation,,openai; no-free-anon; multimodal; tools; cc-native; json; structured-output; ocr,,1000000,tokens,$0.1000 in/1M tokens; $0.4000 out/1M tokens,Yes,google/gemini-2.5-flash
google/gemini-2.5-flash,google,text-generation,"Gemini 2.5 Flash is Google's latest thinking model, designed to tackle increasingly complex problems. It's capable of reasoning through their thoughts before responding, resulting in enhanced performance and improved accuracy.  Gemini 2.5 Flash: best for balancing reasoning and speed.",openai; no-free-anon; multimodal; tools; cc-native; json; structured-output; ocr,,1000000,tokens,$0.3000 in/1M tokens; $2.5000 out/1M tokens,,
google/gemini-2.5-pro,google,text-generation,"Gemini 2.5 Pro is Google's the most advanced thinking model, designed to tackle increasingly complex problems. Gemini 2.5 Pro leads common benchmarks by meaningful margins and showcases strong reasoning and code capabilities.  Gemini 2.5 models are thinking models, capable of reasoning through their thoughts before responding, resulting in enhanced performance and improved accuracy.  The Gemini 2.5 Pro model is now available on DeepInfra.",openai; no-free-anon; multimodal; tools; cc-native; json; structured-output; ocr,,1000000,tokens,$1.2500 in/1M tokens; $10.0000 out/1M tokens,,
google/gemma-1.1-7b-it,google,text-generation,"Gemma is an open-source model designed by Google. This is Gemma 1.1 7B (IT), an update over the original instruction-tuned Gemma release. Gemma 1.1 was trained using a novel RLHF method, leading to substantial gains on quality, coding capabilities, factuality, instruction following and multi-turn conversation quality.",openai; json,bfloat16,8192,tokens,$0.0700 in/1M tokens; $0.0700 out/1M tokens,Yes,google/gemma-3-12b-it
google/gemma-2-27b-it,google,text-generation,"Gemma is a family of lightweight, state-of-the-art open models from Google. Gemma-2-27B delivers the best performance for its size class, and even offers competitive alternatives to models more than twice its size. ",openai,bfloat16,8192,tokens,$0.2700 in/1M tokens; $0.2700 out/1M tokens,Yes,google/gemma-3-27b-it
google/gemma-2-9b-it,google,text-generation,"Gemma is a family of lightweight, state-of-the-art open models from Google. The 9B Gemma 2 model delivers class-leading performance, outperforming Llama 3 8B and other open models in its size category.",openai,bfloat16,8192,tokens,$0.0300 in/1M tokens; $0.0600 out/1M tokens,Yes,google/gemma-3-12b-it
google/gemma-3-12b-it,google,text-generation,"Gemma 3 introduces multimodality, supporting vision-language input and text outputs. It handles context windows up to 128k tokens, understands over 140 languages, and offers improved math, reasoning, and chat capabilities, including structured outputs and function calling. Gemma 3-12B is Google's latest open source model, successor to Gemma 2",openai; cc-native; json; multimodal; tools; structured-output; ocr,bfloat16,131072,tokens,$0.0400 in/1M tokens; $0.1300 out/1M tokens,,
google/gemma-3-27b-it,google,text-generation,"Gemma 3 introduces multimodality, supporting vision-language input and text outputs. It handles context windows up to 128k tokens, understands over 140 languages, and offers improved math, reasoning, and chat capabilities, including structured outputs and function calling. Gemma 3 27B is Google's latest open source model, successor to Gemma 2",openai; cc-native; json; tools; multimodal; structured-output; ocr,fp8,131072,tokens,$0.0800 in/1M tokens; $0.1600 out/1M tokens,,
google/gemma-3-4b-it,google,text-generation,"Gemma 3 introduces multimodality, supporting vision-language input and text outputs. It handles context windows up to 128k tokens, understands over 140 languages, and offers improved math, reasoning, and chat capabilities, including structured outputs and function calling. Gemma 3-12B is Google's latest open source model, successor to Gemma 2",openai; cc-native; multimodal; json; tools; structured-output; ocr,bfloat16,131072,tokens,$0.0400 in/1M tokens; $0.0800 out/1M tokens,,
google/veo-3.0,google,text-to-video,"Veo 3 is a state-of-the-art text-to-video model from Google that generates high-fidelity, cinematic videos with synchronized audio from a simple text prompt. It excels at creating realistic and imaginative scenes with a deep understanding of natural language and visual dynamics.",,,,output_length,$0.4000/second,,
google/veo-3.0-fast,google,text-to-video,"Veo 3 Fast is a speed-optimized version of the Veo 3 model, designed for rapid video creation. While maintaining high quality, it delivers results in a fraction of the time, making it ideal for quick iterations and dynamic content generation.",,,,output_length,$0.1500/second,,
google/veo-3.1,google,text-to-video,"Veo 3.1 is the latest text-to-video model from Google that generates high-fidelity, cinematic videos with synchronized audio from a simple text prompt. It excels at creating realistic and imaginative scenes with a deep understanding of natural language and visual dynamics.",,,,output_length,$0.4000/second,,
google/veo-3.1-fast,google,text-to-video,"Veo 3.1 is the latest text-to-video model from Google that generates high-fidelity, cinematic videos with synchronized audio from a simple text prompt. It excels at creating realistic and imaginative scenes with a deep understanding of natural language and visual dynamics.",,,,output_length,$0.1500/second,,
hexgrad/Kokoro-82M,hexgrad,text-to-speech,"Kokoro is an open-weight TTS model with 82 million parameters. Despite its lightweight architecture, it delivers comparable quality to larger models while being significantly faster and more cost-efficient. With Apache-licensed weights, Kokoro can be deployed anywhere from production environments to personal projects.",priority,,,input_character_length,$NaN/1M characters,,
intfloat/e5-base-v2,intfloat,embeddings,Text Embeddings by Weakly-Supervised Contrastive Pre-training. Model has 24 layers and 1024 out dim. ,,,512,input_tokens,$0.0050/1M tokens,,
intfloat/e5-large-v2,intfloat,embeddings,Text Embeddings by Weakly-Supervised Contrastive Pre-training. Model has 24 layers and 1024 out dim. ,,,512,input_tokens,$0.0100/1M tokens,,
intfloat/multilingual-e5-large,intfloat,embeddings,"The Multilingual-E5-large model is a 24-layer text embedding model with an embedding size of 1024, trained on a mixture of multilingual datasets and supporting 100 languages.",,fp32,512,input_tokens,$0.0100/1M tokens,,
intfloat/multilingual-e5-large-instruct,intfloat,embeddings,"The Multilingual-E5 models, initialized from XLM-RoBERTa, support up to 512 tokens per input — any longer text will be silently truncated. To ensure optimal performance, always prefix inputs with “query:” or “passage:”, as the model was explicitly trained with this format.",,,512,time,$NaN/second,,
lizpreciatior/lzlv_70b_fp16_hf,lizpreciatior,text-generation,A Mythomax/MLewd_13B-style merge of selected 70B models  A multi-model merge of several  LLaMA2 70B finetunes for roleplaying and creative work. The goal was to create a model that combines creativity with intelligence for an enhanced experience.,openai,fp16,4096,tokens,$0.3500 in/1M tokens; $0.4000 out/1M tokens,Yes,meta-llama/Llama-3.3-70B-Instruct-Turbo
mattshumer/Reflection-Llama-3.1-70B,mattshumer,text-generation,Reflection Llama-3.1 70B is trained with a new technique called Reflection-Tuning that teaches a LLM to detect mistakes in its reasoning and correct course.  The model was trained on synthetic data.,openai,bfloat16,8192,tokens,$0.3500 in/1M tokens; $0.4000 out/1M tokens,Yes,meta-llama/Meta-Llama-3.1-70B-Instruct
meta-llama/Llama-2-13b-chat-hf,meta-llama,text-generation,"Llama 2 is a collection of pretrained and fine-tuned generative text models ranging in scale from 7 billion to 70 billion parameters. This is the repository for the 7B fine-tuned model, optimized for dialogue use cases and converted for the Hugging Face Transformers format. ",openai; json,fp16,4096,tokens,$0.1300 in/1M tokens; $0.1300 out/1M tokens,Yes,meta-llama/Meta-Llama-3-8B-Instruct
meta-llama/Llama-2-70b-chat-hf,meta-llama,text-generation,LLaMa 2 is a collections of LLMs trained by Meta. This is the 70B chat optimized version. This endpoint has per token pricing.,openai; json,fp16,4096,tokens,$0.6400 in/1M tokens; $0.8000 out/1M tokens,Yes,meta-llama/Meta-Llama-3.1-70B-Instruct-Turbo
meta-llama/Llama-3.2-11B-Vision-Instruct,meta-llama,text-generation,"Llama 3.2 11B Vision is a multimodal model with 11 billion parameters, designed to handle tasks combining visual and textual data. It excels in tasks such as image captioning and visual question answering, bridging the gap between language generation and visual reasoning. Pre-trained on a massive dataset of image-text pairs, it performs well in complex, high-accuracy image analysis.  Its ability to integrate visual understanding with language processing makes it an ideal solution for industries requiring comprehensive visual-linguistic AI applications, such as content creation, AI-driven customer service, and research.",openai; cc-native; multimodal; json; structured-output; ocr,fp8,131072,tokens,$0.0490 in/1M tokens; $0.0490 out/1M tokens,,
meta-llama/Llama-3.2-1B-Instruct,meta-llama,text-generation,The Meta Llama 3.2 collection of multilingual large language models (LLMs) is a collection of pretrained and instruction-tuned generative models in 1B and 3B sizes (text in/text out).,openai; tools,bfloat16,131072,tokens,$0.0050 in/1M tokens; $0.0100 out/1M tokens,Yes,meta-llama/Llama-3.2-3B-Instruct
